question,answer,source
"According to Albrecht's approach, what constitutes 'soil health'?","Albrecht's approach to 'soil health,' developed in 1916, likely encapsulates a holistic understanding of soil as a living ecosystem. This involves assessing physical, chemical, and biological properties comprehensively to promote sustainable agricultural practices and long-term soil fertility.",SoilQA
"According to Simpson (1983), what is the basis of agriculture?",Soil,SoilQA
"According to Table 2, what is the harvest interval for aerated slurry of non-organic origin applied to horticultural land?",The harvest interval for aerated slurry of non-organic origin is one year.,SoilQA
"According to organic standards, what should be developed in rotation design?",Rotations should be developed to balance the nutritional and structural demands on the soil.,SoilQA
"According to the text, what drives the growth of organic food and farming movement?","The growth of the organic food and farming movement is driven by a better understanding of how farming methods interact with human health, the environment, and the welfare of animals and society. This comprehensive perspective fuels the movement's expansion.",SoilQA
"According to the text, what is the target range for magnesium content in a balanced soil?",The target range for magnesium content in a balanced soil is between 10 and 20 percent.,SoilQA
After how many days does the temperature of compost heap start to drop?,After about 14 days.,SoilQA
Analyse how the DEFRA and SAC soil nutrient levels tabulated information could benefit organic farm management.,"The DEFRA index and SAC description provide a structured understanding of soil nutrient levels, aiding organic farmers in diagnosing soil nutrient statuses accurately and deciding on suitable soil amendments and cropping strategies to enhance soil health and crop productivity.",SoilQA
Analyze how different management practices might impact nitrogen fixation in leys.,"Different management practices like cutting or grazing can have varied impacts on nitrogen fixation in leys. Cutting might lead to a more controlled regrowth and better litter deposition, aiding microbial activity. Grazing, on the other hand, might affect plant growth cycles and soil compaction. Each practice alters nitrogen dynamics and soil health in distinct ways.",SoilQA
Analyze how nutrient budgets and changes in soil phosphorus levels can help in making informed decisions regarding phosphorus supplementation.,"Nutrient budgets, combined with monitoring soil phosphorus levels over time, provide a detailed understanding of phosphorus dynamics. This approach aids in determining whether a rotation requires supplemental phosphorus to balance nutrient removal by crops, ensuring soil fertility and sustainability.",SoilQA
Analyze how organic and mineral fertilizers contribute to calcium gains in soil.,"Organic and mineral fertilizers rapidly release calcium that can be immediately utilized by plants. Available soil minerals and exchange sites facilitate this process, ensuring a steady input of calcium. These fertilizers serve as vital sources for replenishing calcium, particularly in soils that frequently undergo nutrient leaching, thus supporting plant growth and development.",SoilQA
Analyze how proper rotation design can aid in both pest and weed control in organic farming systems.,"Proper rotation design aids pest and weed control by disrupting pest life cycles, reducing their populations, and suppressing weed growth. Incorporating diverse crops and adequate ley proportions enhances soil health, minimizing weed and pest prevalence without synthetic chemicals.",SoilQA
Analyze how the composting process aligns with principles of sustainable agriculture.,"Composting aligns with sustainable agriculture principles by recycling organic waste into valuable soil amendments, enhancing soil health, and fertility. It reduces the need for chemical fertilizers, mitigates nutrient runoff, and supports biodiversity with beneficial microorganisms. The slow-release nutrients improve crop resilience and productivity while maintaining environmental balance, contributing to long-term agricultural sustainability and resource efficiency.",SoilQA
Analyze how the principles of nutrient management and erosion control in organic farming reflect broader ecological sustainability goals.,"Nutrient management and erosion control in organic farming align with ecological sustainability by minimizing external inputs, enhancing natural nutrient cycles, and protecting soil health. Practices like strategic manure use, nutrient monitoring, and erosion risk mitigation conserve resources, reduce environmental impact, and support resilient agricultural ecosystems.",SoilQA
Analyze how the use of vetch can complement the growth of cereals in crop rotations.,"Vetch (Vicia sativa) enhances crop rotations with cereals like rye and ryegrass by fixing atmospheric nitrogen into the soil, enriching it. This reduces the need for synthetic fertilizers and supports subsequent cereal growth, fostering a balanced, sustainable cropping system.",SoilQA
Analyze the advantages and disadvantages of medium textured soils in terms of crop establishment and soil management.,"Medium textured soils have the advantage of forming good seedbeds and retaining moisture, which supports rapid crop establishment. However, they can also present disadvantages, particularly at the heavier end of the spectrum, where they may need weathering and have more restricted optimal soil working conditions. These factors require careful management to balance ease of use and long-term soil health.",SoilQA
Analyze the economic and ecological benefits of incorporating break crops into an organic farming rotation system.,"Break crops provide economic benefits by reducing input costs through natural nutrient addition and pest control, enhancing yields and profits. Ecologically, they improve soil health, promote biodiversity, reduce erosion, and enhance resilience to climate impacts, fostering sustainable farming systems.",SoilQA
Analyze the effects of the rapid establishment of green manures on soil erosion and nutrient leaching.,"The rapid establishment of green manures is vital in preventing soil erosion and nutrient leaching. Quick-growing cover crops form a protective shield over the soil, reducing wind and water erosion. They also absorb and retain nutrients, preventing them from leaching away, hence maintaining soil fertility and stability.",SoilQA
Analyze the implications of improper sample mixing and packaging on the analysis results.,"Improper sample mixing can lead to non-representative samples, resulting in inaccurate or misleading analysis results. Inadequate packaging, such as unclean or poorly labelled bags, can cause contamination or misidentification, further compromising the validity and reliability of the analysis outcomes.",SoilQA
Analyze the implications of soil types on the relationship between fungi and plant roots.,"Soil types can significantly affect the extension and efficiency of fungal hyphae. Different soils may offer varied nutrient availability and water retention capacities. Fungal hyphae must adapt to these differences, impacting how effectively they can support plant roots in nutrient and water absorption.",SoilQA
Analyze the importance of understanding soil biology in sustainable agricultural practices.,"Understanding soil biology is vital for sustainable agriculture as it reveals hidden interactions and processes critical for soil health. Soil fungi and bacteria decompose organic matter, cycle nutrients, and enhance plant growth. Recognizing these biological functions helps in implementing practices that maintain soil fertility and plant health.",SoilQA
Analyze the issues caused by fine seedbeds for late established crops.,"Fine seedbeds for late established crops can lead to soil crusting, compaction, and erosion. These conditions make it difficult for seeds to germinate and establish strong root systems, reducing crop yields. Fine seedbeds also increase the risk of nutrient leaching and water runoff, compromising soil fertility. By avoiding them, farmers can improve seedling emergence and crop performance.",SoilQA
Analyze the potential benefits of using red clover for long-term soil health improvement.,"Red clover benefits long-term soil health through its deep taproot that enhances soil structure and aeration, boosting fertility. Suitable for prolonged cover (one or two years), its wide pH tolerance (4.5-8.2) and good to excellent hardiness make it a sustainable soil-improving option. Early September planting ensures robust growth.",SoilQA
Analyze the role of composting in sustaining soil fertility on organic farms.,"Composting plays a critical role in sustaining soil fertility on organic farms by recycling organic waste into nutrient-rich compost. This humus-rich material improves soil structure, enhances moisture retention, increases microbial activity, and provides essential nutrients, promoting long-term soil health and productivity.",SoilQA
Analyze the role of cover crops in preventing soil erosion and maintaining fertility.,"Cover crops play a critical role in preventing soil erosion by providing ground cover that protects the soil from wind and water erosion. Their roots stabilize the soil, and their biomass adds organic material upon decomposition, enhancing soil structure, moisture retention, and overall fertility.",SoilQA
Analyze the role of mustard as a green manure in organic farming systems.,"Mustard serves as an effective green manure in organic farming due to its rapid growth and ability to supply abundant organic matter. As a “lifter,” it scavenges nutrients, enhancing soil fertility. Additionally, mustard's bio-fumigant properties help control soil-borne pests, improving soil health and crop productivity in sustainable farming systems.",SoilQA
Analyze the role of standard systems like DEFRA and SAC in agricultural practices.,"Standard systems like DEFRA (numerical) and SAC (descriptive) provide consistent frameworks for assessing and managing soil nutrients. These systems facilitate targeted fertilization and soil amendment practices, thereby improving agricultural productivity and sustainability across different regions.",SoilQA
Analyze the rotational strategy highlighted in the exemplary rotation and explain its benefits for pest management and crop production.,"The rotational strategy includes grass/clover ley for three years, followed by winter wheat and spring cereal or forage maize. This strategy benefits pest management by breaking pest cycles. It also improves soil fertility through diverse crop roots and organic matter deposition, leading to enhanced crop yields.",SoilQA
Analyze the significance of heavy metal analysis and the declaration of non-GMO ingredients required by organic standards.,"Heavy metal analysis and the declaration of non-GMO ingredients are crucial in maintaining the purity and safety standards of organic products. This ensures that the end product is free from contaminants that could harm health or the environment, aligning with the core principles of organic farming and consumer trust.",SoilQA
Analyze the significance of incorporating organic matter in fertility management programs for plant health.,"Incorporating organic matter into fertility management programs is significant for plant health as it not only enriches the soil with a broad range of essential nutrients, fostering balanced growth, but also enhances soil structure, water retention, and microbial activity, all contributing to overall plant vitality.",SoilQA
Analyze the significance of using microbial starters in composting and how they can expedite the composting process.,"Microbial starters introduce specific microorganisms that enhance the decomposition process. These starters contain strains of bacteria and fungi that accelerate breakdown by boosting microbial activity in the compost heap. Their use leads to faster and more efficient compost production, saving time and improving compost quality.",SoilQA
Analyze the trade-offs involved in managing calcium levels through manure and compost applications.,"Managing calcium levels through manure and compost applications involves trade-offs. While these organic amendments add essential nutrients, including calcium, they also increase the risk of leaching, especially in lighter soils. This leaching can reduce the availability of calcium over time. To balance these effects, continuous monitoring and supplemental fertilization may be required, ensuring consistent soil fertility and optimal crop growth.",SoilQA
"Apart from regular soil analysis, in what scenarios is extra analysis advised?","Extra analysis is advised when growing demanding crops like brassicas or potatoes, when introducing a new crop, or when there is suspicion of nutrient deficiency.",SoilQA
Approximately how many nematode species are present in UK soils?,25,SoilQA
Are the necessary biodiversity levels in the soil known?,"The required levels of biodiversity in the soil to perform essential functions are currently uncertain. However, it is clear that these levels are very high.",SoilQA
Are there any serious pest problems for rye and vetches when used as green manures?,"Rye and vetches do not have any serious pest problems when used as green manures, making them reliable choices.",SoilQA
Assess how ‘+’ and ‘-‘ index values in the DEFRA system provide a more nuanced understanding of soil health.,"‘+’ and ‘-‘ values in the DEFRA system offer a nuanced approach by showing whether nutrient levels are closer to being insufficient or excessive within a specific range. This detailed data enables more precise amendments, preventing over-fertilization or under-fertilization, thereby optimizing soil health and crop productivity.",SoilQA
Assess the contribution of crop diversification to soil health in organic farming systems.,"Crop diversification contributes to soil health in organic farming by introducing various root structures and organic residues into the soil. This diversity enhances soil structure, nutrient availability, and microbial activity, improving overall soil fertility, reducing specific pest and disease build-up, and promoting sustainable farming practices.",SoilQA
"Assess the role of green manures in sustainable agriculture, considering their nitrogen fixation capability.","Green manures play a vital role in sustainable agriculture due to their nitrogen fixation capability, which adds essential nutrients to the soil. Selecting appropriate legume species, suitable management practices, and understanding environmental factors can optimize nitrogen input, reduce dependency on synthetic fertilizers, and enhance soil fertility, thus creating a more sustainable farming ecosystem.",SoilQA
Assess the trade-offs between using manual tools like a trowel and automated methods for sample preparation.,"Manual tools like a trowel allow for precision and control but are time-consuming and require meticulous effort. Automated methods, although potentially less precise in human control, offer efficiency, speed, and consistency in mixing, reducing the potential for human error and time spent on sample preparation.",SoilQA
At what concentration does available cobalt enter the very high tolerance range?,Available cobalt concentration enters the very high tolerance range at levels above 10.0 mg/l.,SoilQA
At what depth should rye and vetch seeds be sown?,Rye and vetch seeds should be sown at a depth of 25–35mm.,SoilQA
At what height do active roots of most crop varieties usually penetrate?,1–1.5m or more.,SoilQA
At what level does total selenium become sufficient in sandy soils/podzols?,"In sandy soils/podzols, total selenium levels as low as 0.15–0.24 mg/kg are sufficient.",SoilQA
"Besides FYM and composts, what other materials can be used to improve soil fertility?","Besides FYM and composts, crop residues such as green manures, cover crops, and grass/clover leys can be used to improve soil fertility.",SoilQA
Between which years did a substantial portion of soil loss occur in England and Wales?,1995-1998,SoilQA
By when should drilling ideally be completed on medium to heavy soils?,Drilling on medium to heavy soils should be completed by mid-October to avoid increased risks.,SoilQA
Can both white and red clover be mixed in leys?,"Yes, both white and red clover can be mixed to ensure both short and long-term fertility.",SoilQA
Can chicory and clover be overwintered?,"Yes, chicory and clover can be overwintered in suitable areas.",SoilQA
Can green manures and cover crops have negative effects?,"Yes, green manures and cover crops can have negative effects, such as the risk of disease from plant pathogens that multiply in plant debris.",SoilQA
Can mustard be sown late into colder weather?,"No, mustard should not be sown beyond the specified date and is not suitable for late sowing into colder weather.",SoilQA
Can rye and vetches be sown together?,"Yes, rye and vetches can be sown together to provide a more balanced supply of nitrogen over the season.",SoilQA
Can the skills for conducting the 'spade diagnosis method' be quickly learnt?,"Yes, the skills for conducting the 'spade diagnosis method' can be quickly learnt.",SoilQA
Can you explain how mechanical intervention disrupts soil structure?,"Mechanical intervention disrupts soil structure by breaking up aggregates, compacting the soil, and reducing pore space. This leads to decreased aeration, limited water infiltration, and nutrient flow, ultimately impairing plant growth and soil ecosystems.",SoilQA
Can you explain how microbial activity influences soil nutrients?,"Microbial activity, combined with the weathering of clay minerals, releases nutrients into the soil, making them accessible for plant uptake.",SoilQA
Can you explain the procedure to handle and examine the soil block after extraction?,"After extraction, the soil block should be carefully removed with a flat spade, using wood or hands to keep it intact. A simple claw tool should then be used to separate the soil parts without damaging the block's structure, maintaining the integrity for accurate analysis.",SoilQA
Chapter 6 offers insights into what topic?,Protecting soil fertility,SoilQA
Compare and contrast fodder rape and mustard in terms of growth and vulnerability.,"Fodder rape is ideal for nitrate uptake and moderate hardiness, whereas mustard, though quickly growing, is vulnerable to the first frosts and poor in frost resistance. Both should be sown early, yet mustard offers a lesser advantage in resilient growth.",SoilQA
Compare and contrast the DEFRA and SAC systems used in different regions for describing nutrient indices.,"The DEFRA system, used in England and Wales, describes nutrient levels numerically (0-9), indicating deficient to excessive levels. In contrast, the SAC system in Scotland uses descriptive terms to indicate nutrient availability.",SoilQA
Compare and contrast the growing characteristics and purposes of white clover and crimson clover.,"White clover (Trifolium repens) is a perennial plant suitable for long-term growth, with good mid-condition tolerance and a primary role as a low-growing fertility builder. In contrast, Crimson clover (Trifolium incarnatum) is an annual species, sown in September, with moderate soil tolerance and serves primarily for short-term improvements within 2-3 months.",SoilQA
Compare the SAC and DEFRA representations of soil nutrient levels and describe their utility in soil fertility management.,"The SAC offers descriptive categories ('Very low' to 'High'), while DEFRA uses numerical indices (0-5). This dual representation helps in a nuanced understanding of soil nutrient levels, aiding precise soil fertility management decisions in organic farming systems.",SoilQA
Compare the efficiency and effectiveness of using a trowel versus another mixing method for sample preparation.,"Using a trowel is less efficient due to the time and care required for proper mixing, whereas other methods could be faster and require less meticulous handling to achieve a representative sample. Effectiveness depends on the meticulousness applied with a trowel or the technological precision of other methods.",SoilQA
Compare the efficiency of compost to fresh manure or slurry in terms of nutrient losses.,"Compost has lower nutrient losses through runoff or leaching compared to fresh manure or slurry, making it a more efficient option for maintaining nutrient levels in the soil.",SoilQA
Compare the environmental considerations when using quickly available potassium sources versus slow-releasing rock forms.,"Quickly available potassium sources like Kali Vanesse pose higher risks of leaching and require careful application timing to avoid environmental harm. In contrast, slow-releasing rock forms are less likely to leach, providing a more stable and sustainable nutrient supply. Effective nutrient management practices must address these differences to balance crop needs and environmental protection.",SoilQA
Compare the nitrogen release rates between fresh manure and compost.,"Fresh manure releases nitrogen quickly, making it an immediate nutrient source for plants. In contrast, compost releases nitrogen slowly as it is more stable, which minimizes nitrogen loss but doesn’t provide an instant nutrient boost.",SoilQA
Compare the nutrient retention in compost with that in fresh manure.,"Compost has higher nutrient retention compared to fresh manure because it is more stable, reducing nutrient loss through runoff or leaching. Fresh manure and slurry contain more readily soluble nutrients, leading to higher losses. This makes compost a more efficient and environmentally friendly option for nutrient management in soils.",SoilQA
Compare the structural stability of soils with free lime and sandy loams and describe their respective management requirements.,"Soils with free lime exhibit robust structural stability allowing for minimal cultivation and no frequent ploughing. Conversely, sandy loams, being less robust, need regular deep ploughing and sub-soiling to prevent compaction and maintain good structure. This indicates differing management requirements based on soil robustness.",SoilQA
"Considering the disease risks mentioned, what might be a strategy to safely incorporate green manures and cover crops in agriculture?","A strategy to safely incorporate green manures and cover crops could involve selecting plant types less prone to harboring saprophytic pathogens, managing crop residues efficiently to reduce debris that supports pathogen growth, and monitoring fields for disease symptoms to act promptly.",SoilQA
Convert the nitrogen limits to their equivalent in cattle manure per hectare per year.,The nitrogen limits convert to approximately 28 tonnes and 40 tonnes of cattle manure per hectare per year.,SoilQA
Describe an alternative to mole draining that could be used for soil management.,"An alternative to mole draining in soil management is subsoiling in combination with field drains. This technique involves breaking up compacted soil layers to improve water infiltration and root growth, providing an effective drainage solution for organic farms.",SoilQA
Describe how arbuscular mycorrhiza (AM fungi) establishes a symbiotic relationship with plants.,"AM fungi establish a symbiotic relationship with plants by colonizing their root systems. They extend the root surface area, enhancing water and nutrient absorption, while the plant supplies the fungi with carbohydrates derived from photosynthesis.",SoilQA
Describe how good compost is produced and its key final characteristics.,"Good compost is produced through the microbial decomposition of organic matter in an aerobic environment, resulting in humus. The key characteristics of the final product include being stable, slowly degradable, and providing a long-term source of stabilized soil nutrients. This contributes significantly to soil health and plant growth.",SoilQA
Describe how layer manure and poultry litter differ in nutrient content and potential applications.,"Layer manure contains 30 units of nitrogen, 16 of phosphorus, and 13 of potassium. Poultry litter has higher nutrient content with 60 units of nitrogen, 30 of phosphorus, and 25 potassium. Their application depends on soil nutrient needs; poultry litter suits cases requiring higher nutrient input.",SoilQA
Describe how nutrient inputs such as manures and composts factor into a nutrient budget.,"Nutrients from applied manures and composts are included as inputs in a simple nutrient budget. These are considered along with other inputs like atmospheric deposition, nitrogen fixation by legumes, and crop residue returns to balance nutrient outputs.",SoilQA
Describe how organic soil management techniques contribute to water conservation.,"Organic soil management techniques, such as reduced tillage, compost addition, and cover cropping, contribute to water conservation by improving soil structure and organic matter. These practices enhance soil's water retention capacity, reduce runoff, and increase infiltration, leading to more efficient water use and soil moisture availability.",SoilQA
Describe how the Albrecht method contributes to soil analysis.,"The Albrecht method contributes to soil analysis by measuring the cation exchange capacity, which helps in understanding the soil's ability to hold and exchange cations. This information is critical for managing soil fertility.",SoilQA
