question,answer,source
What type of crops tend to be less nutrient demanding after leys?,Less nutrient demanding crops,SoilQA
What type of drainage is essential for sandy soils and some clay soils where lime is present?,Deep loosening of soil.,SoilQA
What type of fields are often rewarded under agri-environment schemes?,Extensive pasture or hay meadows,SoilQA
What type of fields show the greatest organic matter degradation?,Pasture hedgerows and fields show the greatest organic matter degradation when grazed.,SoilQA
What type of flowers does phacelia produce?,Blue flowers.,SoilQA
What type of land is forage maize stated to be suitable for?,Varies with site and season,SoilQA
What type of manures should be regularly added to the soil to enhance fertility?,Farmyard manure (FYM) and composts should be regularly added to the soil along with crop residues like green manures.,SoilQA
What type of materials are suggested for the mulch?,Green manures.,SoilQA
What type of microorganisms are involved in the mineralisation process?,Soil microorganisms,SoilQA
What type of pathogens should be considered when choosing green manures or cover crops?,"When choosing green manures or cover crops, one should consider pathogens with a saprophytic phase that can multiply in plant debris, such as Rhizoctonia solani.",SoilQA
What type of pests are more likely with reduced tillage?,"Fungal and viral diseases of cereals, more slug damage, and more soil-borne pests.",SoilQA
What type of ploughing is preferred for vegetables grown in silt soil?,Mouldboard ploughing is preferred for vegetables grown in silt soil.,SoilQA
What type of soil is especially important for root cropping?,Light to medium soils.,SoilQA
What type of soil is ploughing and seedbed consolidation preferred in?,Loamy soil.,SoilQA
What type of soil is suitable for mixed systems in organic farms?,Medium/light land is suitable for mixed systems in organic farms.,SoilQA
What type of soils do stock based systems frequently use?,Stock based systems frequently use medium to heavy soils.,SoilQA
What type of system is described in section 7.2?,Mixed systems,SoilQA
What type of systems do organic farming systems seek to achieve sustainability through?,Natural biological cycles,SoilQA
What type of systems is stock based systems compared to in the text?,Stock based systems are compared to cultivation systems.,SoilQA
What type of tillage can reduce the disruption to soil profiles?,Minimum tillage can reduce the disruption to soil profiles.,SoilQA
What type of weather conditions do winter vetch and rye provide cover for when sown late?,Winter vetch and rye provide cover for colder winter weather when sown late.,SoilQA
What types of channels are created in the soil by roots?,Air and drainage channels,SoilQA
What types of crops can be used as winter forage on light and other soils?,"Chicory could be used on light soils, with either forage rape or stubble turnips on other soils.",SoilQA
What types of equipment can be used to form windrows for composting?,"To form windrows for composting, you can use a front-end loader with a FYM spreader fitted with rear doors or specialist windrow turning equipment.",SoilQA
What types of farms is this guide aimed at?,"Organic farms, farmers in conversion, interested farmers",SoilQA
What types of ingredients should be selected for composting?,Those with an appropriate balance of carbon to nitrogen.,SoilQA
What types of land are stock based systems frequently used on?,Medium to heavy soils with sloping ground.,SoilQA
What types of nutrients are involved in agricultural pollution?,"Agricultural pollution involves nutrients such as nitrogen (N), phosphorus (P), and potassium (K), which can be lost from the farming system and pollute the environment.",SoilQA
What types of pollutants can soil organisms degrade?,Soil organisms can degrade pollutants such as nitrate fertilizers and organophosphorus pesticides.,SoilQA
What types of soil organisms are impacted by the inversion process in mouldboard ploughing?,Aerobic and anaerobic microorganisms.,SoilQA
What types of soils are most at risk of erosion?,"Soils low in clay and high in silt, fine sands, and steeply sloping fields.",SoilQA
What types of soils are prone to compaction?,"Soils prone to compaction include light sands, clays, and silts.",SoilQA
What typically provides nitrogen fertility in grazed leys?,Nitrogen transfer between legumes and other crops,SoilQA
What uncertainties do scientists face in understanding soil biodiversity?,Scientists face uncertainties in understanding the precise levels of soil biodiversity required for essential ecological functions. The complexity of soil ecosystems and interactions among diverse soil organisms make it challenging to quantify these biodiversity levels accurately.,SoilQA
What uncertainties exist around soil biodiversity?,"There is uncertainty about the exact levels of biodiversity required in the soil to perform essential roles effectively. Despite this, we know that these levels are very high.",SoilQA
What underpins the principles and practices of organic farming today?,The principles and practices of organic farming today are underpinned by observations of biological cycles of growth and regeneration.,SoilQA
What unique benefit does Phacelia provide when used as a cover crop?,"Phacelia smothers weeds effectively and produces blue flowers that benefit pollinators like bees, wasps, and hover flies.",SoilQA
What varying plough and cultivation depths are required for different crops?,"Different crops require various plough and cultivation depths. For instance, deep ploughing is essential for potatoes, whereas other crops may need shallower depths to optimize soil health and crop growth.",SoilQA
What visual and olfactory signs indicate anaerobic soil conditions?,"Anaerobic soil conditions are indicated by an orange/yellow color and a 'rotten egg' smell, resulting from toxic substances like reduced manganese, iron, and sulfur.",SoilQA
What visual characteristics indicate that composting has finished?,"Finished compost should look like forest soil, being dark brown, friable, and without any unpleasant odors.",SoilQA
What visual characteristics should finished compost have?,"Dark brown, friable, and odor-free.",SoilQA
What was associated with this substantial soil loss?,The substantial soil loss was associated with low levels of erosion from large areas of soil classified as being at low or negligible risk of water erosion.,SoilQA
What will achieving good soil management in the environment receive?,Greater recognition and attention,SoilQA
What will be required as part of the application to enter land for conversion to organic management?,A soil management plan.,SoilQA
What will section 4 provide guidelines for?,Soil analysis,SoilQA
What will the incorporation of cereal crop residues reduce?,Nutrient removal,SoilQA
What will this guide help achieve?,Efficient and sensitive land management,SoilQA
What will this guide provide advice on?,Soil management,SoilQA
What will understanding of soil management help users with?,Understanding of soil and farming operations,SoilQA
What year was the Draft Soil Strategy for England published?,2001.,SoilQA
When are cover crops typically grown?,Cover crops are typically grown over winter to prevent loss of nitrate through leaching.,SoilQA
When are green manures generally incorporated?,Green manures are generally incorporated at the onset of flowering.,SoilQA
When are losses through runoff or leaching lowest?,"Losses through runoff or leaching are lowest when using compost, as opposed to equivalent applications of fresh manure or slurry.",SoilQA
When are sainfoin and lucerne crops sown?,Sainfoin and lucerne crops are typically sown in the spring or summer.,SoilQA
When are some early wheat grain varieties usually harvested?,Late September or early October,SoilQA
When are spring sown root forage crops typically sown?,"Spring sown root forage crops, such as fodder beet and swedes, are typically sown from mid to late spring, specifically in April and sometimes early May.",SoilQA
When are the lowest risk months for water erosion and leaching in winter wheat cultivation?,The lowest risk months for water erosion and leaching in winter wheat cultivation typically coincide with mid-summer when the soil is relatively dry and workable.,SoilQA
When can a spring cereal be sown after harvesting sugar beet?,"A spring cereal can be sown immediately after harvesting sugar beet from mid-December, but more commonly from late January to early February.",SoilQA
When can chicory and clover be utilised after sowing?,Chicory and clover can be utilised within 8–12 weeks after sowing or can be overwintered in suitable areas.,SoilQA
When can forage rape and stubble turnips be sown?,Forage rape and stubble turnips can be sown in summer or early autumn.,SoilQA
When can repeated ploughing to the same depth be detrimental?,"When it reaches up to 30cm depth, harming soil microorganisms, fungi, and soil animals.",SoilQA
When can the harvesting process for these crops generally take place?,The harvesting process for these crops can generally take place at almost any time during the autumn/winter period.,SoilQA
When can vetches and rye be sown for green manure purposes?,August or September,SoilQA
When can vetches be sown to achieve higher yields?,Spring or summer,SoilQA
"When dealing with compaction, what organic matter should be used?",Green manures and crop residues.,SoilQA
When does nitrate leaching occur?,Nitrate leaching occurs when soil nitrate exceeds crop demand and soil moisture permits drainage.,SoilQA
When is a late summer reseed preferable?,When rainfall is at its lowest.,SoilQA
When is it advisable to use non-inversion tillage to establish second cereals and first wheat after pulse crops?,Non-inversion tillage can be used to establish second cereals and first wheat after pulse crops when soil and weather conditions are favorable. This method helps preserve soil structure and reduce tillage-related disruptions.,SoilQA
When is it best to incorporate leys to minimize leaching losses?,June or July,SoilQA
When is it recommended that soil testing be carried out according to organic standards?,"Each year at the same time and place, or at the same point in rotation.",SoilQA
When is it recommended to carry out soil tests in organic farming?,"It is recommended to carry out soil tests each year at the same time and place, or at the same point in the rotation in organic farming.",SoilQA
When is lime rarely required for organic farming soils?,Free lime-containing soils rarely need lime for organic farming.,SoilQA
When is most nitrogen in farmyard manure available?,In the year of application.,SoilQA
When is reduced cultivation suitable for heavier loams?,Reduced cultivation is suitable for heavier loams where free lime is present.,SoilQA
When is rock phosphate normally applied in a ley/arable rotation?,Rock phosphate is typically applied during the ley phase in a ley/arable rotation.,SoilQA
When is subsoiling most effective?,"Subsoiling is most effective in soils that are moist enough to allow for general loosening, as opposed to wet soils where minimal fracturing and heaving of the soil occur.",SoilQA
When is the application of slurries to grassland recommended?,Slurries should be applied to grassland in the spring.,SoilQA
When is the best time for mole draining to ensure the soil is dry enough?,Spring (May or June),SoilQA
When is the best time for soil sampling?,Autumn or spring is the best time.,SoilQA
When is the best time to sample soil to identify compaction problems?,"The best time to sample soil to identify compaction problems is when the soil is moist, specifically in autumn or spring.",SoilQA
When is the best time to sow rye and vetches for winter green manure?,The best time to sow rye and vetches for winter green manure is in August or September.,SoilQA
When is the ley typically used in mixed systems before it is replaced?,First half of the summer,SoilQA
When is the risk of leaching increased?,The risk of leaching is increased when mineralisation is stimulated by cultivation in autumn.,SoilQA
When is the suitable time for green manure sowing to avoid frosts?,Sowing until mid-August,SoilQA
When is the typical harvesting time for main crop potato varieties?,Main crop potato varieties are typically harvested in late September or early October.,SoilQA
"When is usually the best time for moling, and why?","Spring, because the soil needs to be wet enough and the top soil dry enough.",SoilQA
When might soil mineral nitrogen tests be appropriate?,"Soil mineral nitrogen tests are suitable for soils with high nitrogen residues, such as those with high organic manure residues or previously under long-term grassland before cultivation.",SoilQA
"When planning management of housed livestock, what needs to be considered?","When planning the management of housed livestock, it is important to consider gaseous and leaching losses to minimize nutrient losses and environmental pollution.",SoilQA
"When planning the management of housed livestock and manure handling, what needs to be considered?",Gaseous and leaching losses.,SoilQA
When should Mustard be sown?,Early September,SoilQA
When should White clover (Trifolium repens) be sown?,Mid August,SoilQA
When should a plough be incorporated according to basic action guidelines?,"A plough should be incorporated after a grass/clover ley and to establish beans. In other cases, non-inversion tillage is preferred to maintain soil health.",SoilQA
When should a summer green manure be considered if growing an early maturing potato crop?,A summer green manure should be considered ahead of the autumn cereal when growing an early maturing potato crop to prevent nutrient loss.,SoilQA
When should green manure crops be sown in spring and summer?,Just below the surface in a well-prepared seedbed,SoilQA
When should ley incorporation be avoided to minimize environmental damage?,Early ley incorporation should be avoided between June and August to minimize environmental damage and nitrate leaching.,SoilQA
When should leys ideally be retained for incorporation?,Leys should ideally be retained for incorporation in spring and followed with spring established crops that grow and absorb soil nitrogen.,SoilQA
When should maize be sown for optimal growth?,Maize should be sown in May after the first cut silage or early bite for optimal growth.,SoilQA
When should manure and slurry applications take place for optimal nutrient uptake?,Manure and slurry applications should take place in spring and summer for optimal nutrient uptake.,SoilQA
When should mole drains be renewed in weak clay soils?,Every five years.,SoilQA
"When should mustard, phacelia, and crimson clover be sown?","Mustard, phacelia, and crimson clover should not be sown beyond this date.",SoilQA
When should one avoid getting into certain farming situations?,When options or timings are severely restricted.,SoilQA
When should rye be incorporated into the soil?,Rye should be incorporated into the soil in March or April before the seed heads can be felt at the base of the stem.,SoilQA
When should soil analysis be carried out initially during the conversion period?,Soil analysis should be carried out at the start of the conversion period to provide a baseline for measuring future changes.,SoilQA
When should solid manure be applied to grassland?,Solid manure should be applied to grassland in the autumn or winter seasons.,SoilQA
"When should stubble turnips be sown, and what is their key growth month?","Stubble turnips should be sown by early August, and the key month for their growth is August. They are known for good cover and moderate tolerance.",SoilQA
When should the grass be ploughed for maize?,At least four weeks before the maize is sown.,SoilQA
When should the grass be ploughed if there is a high risk of frit damage?,At least four weeks before the maize is sown.,SoilQA
When should the winter wheat for grain and straw production be sown?,In mid-summer.,SoilQA
When should vetches be incorporated into the soil?,Vetches should be incorporated into the soil at the onset of flowering.,SoilQA
When was 'Farm Crop Science' by Bostfield G published?,1964,SoilQA
When was The Draft Soil Strategy for England published?,The Draft Soil Strategy for England was published in 2001.,SoilQA
When was the Soil Association established?,1946,SoilQA
Where are Podzols typically formed?,Podzols are typically formed under coniferous forests or heather moorlands.,SoilQA
Where are nutrient indices either numerical or descriptive?,"Nutrient indices are numerical in England and Wales using the DEFRA system, and descriptive in Scotland using the SAC system.",SoilQA
Where are similar policy initiatives to the Soil Action Plan being undertaken?,"Wales, Northern Ireland, and Scotland.",SoilQA
Where are stock based systems often located in terms of rainfall?,Stock based systems are often located in higher rainfall areas.,SoilQA
Where can farmers get further assistance with nutrient budgeting?,Local Association advisory services.,SoilQA
Where can further information on organic soil fertility be found?,Further information on organic soil fertility can be found at www.organicsoilfertility.co.uk.,SoilQA
Where can one find detailed advice on good soil management practices?,"Detailed advice on good soil management practices can be found in DEFRA’s Code of Good Agricultural Practice for the Protection of Soil, DEFRA’s Controlling Soil Erosion, the Environment Agency’s Best Farming Practices: Profiting from a good environment, and the Scottish Executive’s PEPFAA Code.",SoilQA
Where can one find detailed information about recommended treatments and time periods between application and harvest?,"Detailed information is available in Table 2, which provides recommended treatments and time periods between application and harvest.",SoilQA
Where can one find information about organic benefits and initiatives?,"Fact sheets, technical guides, briefings, and quarterly magazines",SoilQA
Where is Abacus Organic Associates located?,"South Luffenham, Rutland",SoilQA
Where is phosphorus primarily sourced from?,"Phosphorus is primarily sourced from soil minerals, with its amount in the soil determined by the soil's parent material.",SoilQA
Where is the Elm Farm Research Centre (EFRC) located?,Berkshire RG20 0HR,SoilQA
Where is the Soil Association producer services located?,"Bristol House, 40-56 Victoria Street, Bristol BS1 6BY",SoilQA
Where should carbon-based material be placed in the compost heap construction?,"Carbon-based material, such as straw, should be placed at the base of the compost heap.",SoilQA
Where should manure be stored to prevent leaching?,"Manure should be stored indoors, under breathable sheeting, or on hard standing to prevent leaching.",SoilQA
Where should one refer for the latest developments on Soil Association standards?,One should refer to the Soil Association for the latest developments on their standards.,SoilQA
Where should the composting operation ideally be carried out?,The composting operation should ideally be carried out on concrete or hard standing with a slight slope.,SoilQA
Which DEFRA document focuses on diffuse pollution evaluation?,Good Practice for the Prevention of Environmental Pollution from Agricultural Activity,SoilQA
Which SAC category corresponds to a DEFRA index of 5?,The SAC category that corresponds to a DEFRA index of 5 is 'High'.,SoilQA
Which annual report does the Soil Association produce at a discount?,The Organic Food and Farming Report,SoilQA
Which are the pH tolerances of Crimson clover (Trifolium incarnatum)?,4.8–8.2 (Optimal: 5.7–6.4),SoilQA
Which areas should be avoided while collecting soil samples?,"Avoid sampling areas that may be compacted or receive high levels of dung and urine, such as around troughs, feeders, gateways, and trees.",SoilQA
Which aspect of pollution does soil management aim to reduce?,Reduction in pesticide pollution.,SoilQA
"Which book by Batey T focuses on the management of soil, crop, and land use?",Soil Husbandry – A practical guide,SoilQA
Which booklet by DEFRA deals with the control of soil erosion?,Controlling Soil Erosion,SoilQA
Which chapter provides information on testing for compaction?,Chapter 4,SoilQA
Which clover is preferred for leys intended to last longer than three years?,White clover is preferred for leys intended to last longer than three years.,SoilQA
Which clover is recognized as a good low-growing fertility builder?,White clover is recognized as a good low-growing fertility builder.,SoilQA
Which components in Table 9 have the highest C:N ratio?,"Sawdust has the highest C:N ratio among the listed components in Table 9, ranging from 200:1 to 750:1.",SoilQA
Which compost ingredient has a C:N ratio of 22:1–50:1?,Horse manure.,SoilQA
Which compost ingredient has a carbon to nitrogen ratio of 200:1-750:1?,Sawdust,SoilQA
Which compost ingredient has the highest C:N ratio and carbon content?,Sawdust.,SoilQA
Which composting method is the most popular and why?,Aerobic windrow composting; involves regular oxygen maintenance.,SoilQA
Which conditions make micronutrients more available in soils?,"Micronutrients are generally more available in acid soils, with the exception of molybdenum.",SoilQA
Which consolidating method can cause seedbed damage?,Compaction.,SoilQA
Which country developed field test kits for soil biology?,United States,SoilQA
Which cover crop is quickly growing but susceptible to first frosts?,"Mustard, known as a quick-growing cover crop, can, unfortunately, be killed by first frosts. It is recognized for its moderate tolerance and early sowing period.",SoilQA
Which cover crop is suitable for smothering weeds?,Phacelia is particularly suitable for smothering weeds due to its strong rooting system. It has moderate tolerance and is usually sown in mid-August.,SoilQA
Which crop benefits from high nitrogen availability but can suffer from wireworm damage if grown immediately after long grass/clover ley?,Potatoes,SoilQA
Which crop benefits from high nitrogen availability but can suffer from wireworm damage?,Potatoes,SoilQA
Which crop can be grown before sowing winter wheat?,"Stubble turnips, which are resistant to frit and other ley pests, can be planted and fed to livestock before sowing the winter wheat in autumn.",SoilQA
Which crop is a very good long-growing fertility builder?,White clover,SoilQA
Which crop is best for sandy soil?,"Crops like groundnut, millets, and watermelon grow well in sandy soils.",FarmingFAQ
Which crop is described as a popular winter hardy species?,Rye,SoilQA
Which crop is grown in the third year of rotation according to the exemplary rotation plan?,Winter wheat,SoilQA
Which crop is known as the best quick growing cover crop?,Mustard (Sinapis alba),SoilQA
Which crop is known for its ability to smother weeds?,Phacelia,SoilQA
Which crop is sown in the sixth year of exemplary rotation for horticultural crops?,Brassicas or umbellifers (carrots/parsnips),SoilQA
Which crop is suitable for one or two years of cover?,Red clover,SoilQA
Which crop is undersown with ley in the seventh year of rotation?,"In the seventh year of rotation, spring barley is undersown with ley.",SoilQA
Which crop is undersown with ley in the sixth year of exemplary rotation?,Winter oats,SoilQA
Which crop is undersown with ley in the sixth year of rotation?,"In the sixth year of rotation, winter oats are undersown with ley. This practice aids in maintaining soil structure and fertility while providing cover to reduce weed growth.",SoilQA
Which crop must be sown by early August?,Stubble turnips (Brassica rapae),SoilQA
Which crop offers an opportunity to apply available manure and slurried nutrients when the soil conditions favor it?,Grass.,SoilQA
Which crop rotation element should be considered on medium to heavy soils?,Grass rotation with well structured ley,SoilQA
Which crop's pH tolerance ranges between 4.8–8.2?,Crimson clover,SoilQA
Which crops are drilled in spring/summer or transplanted in summer/autumn according to exemplary rotation?,Leek/onion,SoilQA
Which crops are grown in year six of the rotation?,"In year six, brassicas or umbellifers (carrots, parsnips) are sown in spring/summer.",SoilQA
Which crops are planted in year three and what follows after harvest?,"In year three, potatoes are planted, and after harvest, a rye cover crop is sown ahead of planting or sowing alliums.",SoilQA
Which crops are recommended if a longer interval and winter hardiness are required?,"If a longer interval (8-12 weeks) and winter hardiness are required, chicory on light land or rye is recommended.",SoilQA
Which crops are specifically mentioned as good options for grazing before winter cereal?,"Chicory, forage rape, stubble turnips.",SoilQA
Which crops are suitable for light land sites in mixed systems?,"Chicory, forage rape, stubble turnips",SoilQA
Which crops can be grown in the later years of the rotation?,"Less nutrient demanding crops, such as oats, triticale, or carrots, can be grown in the later years of the rotation.",SoilQA
Which crops can be sown in summer or early autumn for autumn utilisation?,"Forage rape and stubble turnips can be sown in summer or early autumn for use in the autumn, before reseeding or sowing a winter cereal.",SoilQA
Which crops can be undersown with legumes in the rotation?,Cereals and grasses.,SoilQA
Which crops can benefit from the residual nitrogen released by incorporated leys?,Nitrogen demanding cash crops,SoilQA
Which crops have a higher demand for potassium compared to cereal crops?,"Root crops such as potatoes, sugar beet, and green fodder crops have a much higher demand for potassium compared to cereal crops.",SoilQA
