question,answer,source
How does poaching affect the soil and crops?,"Poaching causes physical damage to crops and soil, resulting in bare patches, increased erosion and leaching, and the emergence of invasive weeds.",SoilQA
How does poaching contribute to the risk of erosion and leaching?,"Poaching damages crops and soil, creating bare patches which heighten the risk of erosion and leaching. This degradation can destabilize soil, leading to increased runoff and nutrient loss, and facilitating conditions for invasive weeds to establish.",SoilQA
How does poaching frequently impact the fields?,"Poaching frequently impacts the fields by creating damage at gateways, tracks, and paths.",SoilQA
How does potassium availability differ from that of nitrogen and phosphorus?,Potassium availability is less dependent on biological processes compared to nitrogen and phosphorus.,SoilQA
How does potassium from crop processing by-products compare to rock forms?,"Potassium from crop processing by-products like Kali Vanesse and Raphinate is released to plants much quicker than potassium from rock forms, making it more immediately available for plant uptake.",SoilQA
How does preserving soil structure through non-mechanical means benefit crop productivity?,"Preserving soil structure through non-mechanical means benefits crop productivity by maintaining optimal soil conditions for root growth, nutrient uptake, and water retention. Healthy soil structure enhances plant health and yields, making it a vital aspect of successful organic farming.",SoilQA
How does previous agricultural activity complicate the reduction of cultivation without harming soil structure?,"Previous agricultural activities can leave legacy effects such as compacted layers, residual agrochemicals, or altered soil structure, making it challenging to reduce cultivation without risking further soil degradation and crop productivity issues.",SoilQA
How does proper root growth improve soil?,Decaying organic matter improves soil structure.,SoilQA
How does reduced tillage contribute to soil management on organic farms?,"Reduced tillage contributes by minimizing soil disturbance, which preserves soil structure, reduces erosion, enhances water retention, and promotes beneficial microbial activity.",SoilQA
How does reducing pesticide residues improve health?,"Reducing pesticide residues improves crop, animal, and human health by decreasing exposure to harmful chemicals.",SoilQA
How does reducing supplementary artificial irrigation benefit agriculture?,It reduces dependence on artificial water sources.,SoilQA
How does regulating the flow of water impact the planet?,"Regulating the flow of water on the planet helps to manage flood risks, ensure adequate water supply, and maintain healthy ecosystems.",SoilQA
How does regulating water flow contribute to environmental sustainability?,"Regulating water flow contributes to environmental sustainability by controlling floods, ensuring adequate water distribution, and maintaining aquatic ecosystems' health. This balance reduces environmental stress and supports biodiversity.",SoilQA
How does routine soil analysis provide insight into the phosphorus availability in organic systems over time?,Routine soil analysis offers a snapshot of available phosphorus in organic systems but does not account for long-term availability from rock P residues or soil organic matter.,SoilQA
How does sample size affect chemical analysis results?,"Sample size affects chemical analysis results as an insufficient sample may not capture the variability within the batch, whereas too large a sample may be impractical to handle and analyze efficiently.",SoilQA
"How does sediment erosion contribute to watercourse pollution, and what can be the possible downstream effects?","Sediment erosion introduces excess nutrients and particles into watercourses, leading to pollution. This can result in algal blooms, reduced water quality, and negatively affect aquatic life and human health.",SoilQA
How does seed bed preparation and weed control lead to nitrogen mineralisation?,"During seed bed preparation and weed control, cultivation disrupts the soil, leading to increased microbial activity that converts organic nitrogen into inorganic forms, a process known as mineralisation. This can result in nitrogen loss, reducing soil fertility for the following crops.",SoilQA
How does shallow ploughing combined with deeper cultivations benefit organic agriculture?,"Shallow ploughing combined with deeper cultivations benefits organic agriculture by loosening lower soil horizons and creating ideal conditions for crop rooting, thus enhancing soil aeration and nutrient availability without excessive soil disruption.",SoilQA
How does soil biology contribute to disease suppression?,Soil biology helps in disease suppression by potentially managing and reducing soil-borne diseases through various biological processes and interactions.,SoilQA
How does soil biology contribute to overall environmental health?,"Soil biology contributes to environmental health by regulating nutrient cycles, decomposing organic matter, and controlling pest populations. These processes enhance soil fertility, promote biodiversity, and improve water quality, supporting sustainable agricultural and environmental practices.",SoilQA
How does soil compaction by heavy machinery affect soil structure?,Soil compaction by heavy machinery necessitates assistance like drainage and soil subsoiling to improve soil structure and ensure proper aeration and root growth.,SoilQA
How does soil erosion affect crop yields and soil quality?,Soil erosion affects crop yields and soil quality by being detrimental to soil biodiversity.,SoilQA
How does soil health contribute to the control of disease?,Supporting other organisms and the surrounding environment,SoilQA
How does soil health influence agricultural sustainability and environmental quality?,"Soil health is crucial for agricultural sustainability as it directly affects crop productivity and quality. Additionally, healthy soil mitigates erosion and pollution, thereby enhancing environmental quality on both local and global scales.",SoilQA
How does soil management integrate with overall farm activities?,Soil management integrates with overall farm activities by ensuring that soil health and fertility are maintained through careful consideration of every farm activity throughout the entire production cycle. This holistic approach supports sustainable agricultural practices.,SoilQA
How does soil organic matter (SOM) affect soil water retention and aeration?,"SOM improves soil's water retention and drainage capabilities and enhances soil aeration. Additionally, it regulates the soil's cation exchange capacity (CEC), crucial for maintaining nutrient balance and soil structure.",SoilQA
How does soil organic matter change during a ley/arable rotation?,"In a ley/arable rotation, soil organic matter builds up during the ley phase and declines during the arable phase.",SoilQA
How does soil pH affect the availability of nutrients to plants?,"Soil pH significantly affects nutrient availability to plants, with different crops having specific pH requirements to maximize nutrient uptake.",SoilQA
How does soil parent material affect the amount of phosphorus in soil?,Soil parent material affects the phosphorus content because the minerals derived from the parent material contribute to the overall phosphorus available in the soil.,SoilQA
How does soil play a role in the degradation of environmental pollutants?,"Soil degrades environmental pollutants through the action of bacteria and fungi, breaking down various waste materials.",SoilQA
How does soil structure impact erosion risk?,Soil structure significantly impacts erosion risk; well-structured soils are much less susceptible to erosion compared to poorly structured soils.,SoilQA
How does soil structure impact the formation of plough pans?,"Soil structure impacts plough pan formation through the dispersion and drying of clay particles when the soil's plastic limit is exceeded. This results in dense clods, compacting the soil and creating plough pans that hinder root growth and water infiltration.",SoilQA
How does soil temperature affect crop growth?,"Soil temperature significantly affects crop growth. Low temperatures hinder root growth and microorganism activity, thereby reducing nutrient supply.",SoilQA
How does soil texture compare to soil structure in terms of management and improvement?,"Soil structure can be improved with careful management practices, whereas soil texture, which involves mineral composition and particle size distribution, is much more difficult to alter.",SoilQA
How does soil type influence magnesium (Mg) reserves?,"Sandy soils typically have low magnesium reserves, making them more susceptible to magnesium deficiencies.",SoilQA
How does soil type influence the interpretation of soil analysis results?,Different soil types have varying capacities to retain and supply nutrients. A consultant familiar with the specific soil type can better interpret analysis results.,SoilQA
How does soil type influence the risk of structural damage and the timing of harvesting?,"Medium to heavy soils have a coarser crumb structure and higher water holding capacity, reducing leaching and run-off risks. However, they are more susceptible to structural damage if cultivated wet, necessitating timely harvesting before autumn rains increase this risk.",SoilQA
How does stabilising nutrients in compost prevent pathogen colonisation?,"Stabilised nutrients create an environment that is not conducive for pathogens to thrive, as they lack the necessary conditions to colonize. This stabilization marks the compost as mature and nutritionally balanced, ensuring it remains useful and safe.",SoilQA
How does subsoiling help soil drainage and structure?,"Subsoiling improves soil drainage, root penetration, and increased water availability.",SoilQA
How does subsoiling help with soil structure?,"It produces better drainage, root penetration, and increases water availability.",SoilQA
How does subsoiling impact fields with undulating terrain?,"In undulating fields with poor natural drainage, subsoiling can exacerbate drainage issues by causing water to accumulate in the lower areas of the field, potentially leading to waterlogging and reduced soil productivity.",SoilQA
How does sulphur deficiency affect plant growth?,"Sulphur deficiency has a profound effect on plant growth, similar to the effects of nitrogen deficiency.",SoilQA
"How does sulphur deficiency manifest in plants, and what parallels can be drawn with another nutrient?","Sulphur deficiency manifests in plants as stunted growth and poor development, similar to nitrogen deficiency. Both nutrients are vital for protein synthesis and general plant health.",SoilQA
How does sulphur reach plants from organic forms?,Sulphur in organic forms requires microbial activity to become available to plants.,SoilQA
How does temperature control affect composting?,Controlling heat between 55°C to 70°C helps kill pathogens.,SoilQA
How does the 'spade diagnosis method' contribute to sustainable farming practices?,"The 'spade diagnosis method' contributes to sustainable farming by enabling farmers to regularly assess and monitor soil health. By identifying issues such as compaction and drainage problems, and implementing corrective measures, farmers can maintain and improve soil fertility and structure, leading to sustainable crop production and environmental stewardship.",SoilQA
How does the 'spade diagnosis method' help farmers?,"The 'spade diagnosis method' helps farmers by identifying soil structure problems such as compaction, drainage issues, and root restrictions, allowing them to develop measures to maintain and improve soil health and productivity.",SoilQA
How does the Balzer-P extraction procedure differ from conventional soil analysis?,"Unlike conventional methods, the Balzer-P extraction uses three solutions—citric acid, double lactate, and sodium acetate—to provide more detailed information on soil phosphorus, including reserves, plant availability, and water solubility.",SoilQA
"How does the C:N ratio impact the composting process, and why should it be maintained between 20:1 and 40:1?","The C:N ratio affects the balance of microbial activity, which is crucial for effective decomposition in composting. A ratio between 20:1 and 40:1 ensures optimal microbial activity and helps in maintaining the right conditions for compost formation.",SoilQA
How does the DEFRA index help in guiding phosphorus management practices for different types of farming systems?,"The DEFRA index provides minimum phosphorus level guidelines tailored for arable crops, grassland, and intensive organic horticulture. By specifying indices like 2 for arable crops and 1+ for grassland, it helps farmers manage soil fertility effectively, ensuring sufficient phosphorus is available to meet specific crop needs.",SoilQA
How does the FAO’s recognition of soil biodiversity impact global soil management strategies?,"The FAO's recognition of soil biodiversity emphasizes its crucial role in soil health and productivity, encouraging global soil management strategies that prioritize biodiversity to enhance sustainability and resilience.",SoilQA
How does the Soil Association assist in market development for organic producers?,Through the support and promotion of various initiatives designed to help UK producers succeed.,SoilQA
How does the Soil Association engage with experienced farmers and growers?,"Organizing training, farm walks, and green days to share knowledge on small-scale demonstrations.",SoilQA
How does the Soil Association ensure the prevention of environmental contamination through its standards?,"The Soil Association ensures the prevention of environmental contamination by mandating responsible use of manures within its organic standards. These measures likely include guidelines on application rates, timing, and types of manure that can be used, reducing the potential for pollution.",SoilQA
How does the Soil Association help in understanding soil processes?,"The Soil Association provides technical guides that cover various soil processes, aiding in better soil management and sustainability.",SoilQA
How does the Soil Association promote organic producers’ interests?,"Through representation at industry and government levels, and providing extensive fact sheets, and technical guides.",SoilQA
How does the Soil Association's review affect compost standards?,The Soil Association's review affects compost standards by reconsidering the required maturation time for compost. This ongoing review aims to ensure the composting process meets updated standards for effectiveness and safety.,SoilQA
How does the W-pattern assist in the soil sampling process?,"The W-pattern ensures that soil samples are collected evenly across the field, helping in producing a representative and accurate composite sample.",SoilQA
How does the addition of clay impact the composting process?,"The addition of clay to the compost heap is crucial as it facilitates the development of humic acid substances. These substances bind with clay particles, forming the clay-humus crumb, which is vital for improving soil structure and fertility.",SoilQA
How does the amount of organic matter and nutrients in manure depend on livestock?,"It depends on the type and diet of livestock, bedding used, and the manure production system.",SoilQA
How does the application timing of manure with high readily available nitrogen impact crop yields?,"Applying manure with high readily available nitrogen in late winter or spring aligns with crop growth stages, maximizing nitrogen utilization and boosting crop yields due to better nutrient availability.",SoilQA
How does the availability of nitrogen affect potassium uptake by crops?,"The availability of nitrogen significantly affects potassium uptake by crops because a limited nitrogen supply can restrict the positive response to potassium. When both nitrogen and potassium are adequately available, crops can absorb and utilize these nutrients more effectively, leading to better growth and yields.",SoilQA
How does the clay content of soil influence potassium availability and supplementation?,"Clay content affects potassium availability because soils with less than 20% clay may not retain potassium well, necessitating supplementary potassium additions when deficiencies are proven. This ensures that crops still receive adequate potassium despite the soil's poor retention capacity.",SoilQA
How does the combination of mechanical means and green manures help in alleviating soil compaction?,"Mechanical means and green manures combined help alleviate soil compaction by loosening deeper layers and enriching the topsoil, fostering a better soil structure and microbial environment.",SoilQA
How does the complexity of soil patterns on a farm get influenced by drift materials?,"The complexity of soil patterns on a farm is influenced by drift materials deposited above the parent rock material, creating variability in soil types.",SoilQA
How does the composition of compost influence its application strategy in organic farming?,"Compost's stabilized nutrients minimize leaching risk, allowing safe application timing even for ready-to-eat crops. Its pathogen-free nature enables flexible use, and its weed-seed destruction capability prevents weed spread, making it a strategic component in organic farming with extended benefits.",SoilQA
How does the compost stabilisation process benefit agriculture?,"The compost stabilisation process benefits agriculture by providing stabilised nutrients that minimize leaching, ensuring pathogen-free material suitable even for ready-to-eat crops, and effectively destroying weed seeds, thus reducing their spread back into crop lands.",SoilQA
How does the composting process affect soil structure and organic matter?,The careful use of manures and composts will supplement the effects of rotation for managing soil organic matter and soil structure.,SoilQA
How does the concept of cation exchange capacity relate to soil fertility management?,"Cation exchange capacity relates to soil fertility management by indicating the soil's potential to hold onto essential nutrients and release them to plants. High cation exchange capacity typically means that the soil can retain more nutrients, preventing leaching and ensuring a steady supply to plants.",SoilQA
How does the degradation of pollutants by soil biology affect the environment?,"The degradation of pollutants by soil biology helps clean the environment, reducing potential toxins and harmful substances that could otherwise accumulate and harm ecosystems.",SoilQA
How does the degree of ground cover affect green manure?,The degree of ground cover affects the green manure's ability to prevent leaching and erosion.,SoilQA
How does the degree of ground cover provided by green manures impact environmental sustainability?,"A high degree of ground cover from green manures plays a significant role in environmental sustainability by preventing soil erosion and nutrient leaching. This cover acts as a barrier against erosive forces, preserving soil structure and fertility, and thereby reducing the need for chemical fertilizers and mitigating environmental degradation.",SoilQA
How does the diet of livestock impact the effectiveness of manure as fertilizer?,"The diet of livestock directly impacts the quantity and quality of nutrients and organic matter in manure. Variations in diet can lead to changes in the manure's effectiveness as fertilizer, influencing its role in soil structure maintenance and nutrient provision to crops. Adjusting livestock diets can, therefore, tailor manure composition for specific agricultural needs.",SoilQA
How does the disc harrow differ from primary cultivation tools?,It is used for shallow cultivation and secondary modifications.,SoilQA
How does the effect of crop removal on soil potassium vary according to soil type?,"On very sandy soils, one forage crop can deplete potassium significantly, while on clay soils with high potassium reserves, deficiencies take much longer to appear.",SoilQA
How does the exemplary rotation plan address take-all susceptibility?,"The exemplary rotation includes winter oat or rye in year four because these cereals are less susceptible to take-all, a common soil-borne fungal disease affecting wheat and barley, thereby reducing crop loss risks.",SoilQA
How does the fertility and workability of peat soils contribute to agricultural practices?,"The fertility and ease of workability of peat soils make them highly favorable for agriculture. Their well-structured nature supports diverse crops, and the soil's adaptability reduces the labor required for cultivation, enhancing efficiency and productivity.",SoilQA
How does the frequency of turning change after the initial heat build-up in composting?,"After the initial heat build-up, the frequency of turning can be reduced to once a week.",SoilQA
How does the frost hardiness of green manures influence planting strategies?,"The frost hardiness of green manures significantly influences planting strategies, as non-frost-hardy varieties must be sown and established before cold weather begins (up to mid-August). This ensures that plants can grow and contribute to soil health without succumbing to frost damage.",SoilQA
How does the guide assist users in managing soil health?,The guide assists users by providing an understanding of soil and offering practical information on improving and maintaining soil health. It emphasizes the importance of good soil management for successful organic production.,SoilQA
How does the guide help in efficient land management on organic farms?,"The guide provides comprehensive information on managing soil health, fertility and structure, which helps in achieving efficient and sensitive land management on organic farms.",SoilQA
How does the hand texturing method classify soil that forms a ball but not a ribbon?,"In the hand texturing method, soil that forms a ball but not a ribbon is classified as loamy sand, indicating a texture between sand and finer particles.",SoilQA
How does the historical use of white clover in crop rotation demonstrate its effectiveness in modern organic farming?,"The historical use of white clover in the Norfolk four-course rotation since the 17th century underscores its long-recognized benefits. Clover's ability to fix atmospheric nitrogen makes it crucial for nutrient management. This practice's enduring relevance highlights its effectiveness in maintaining soil fertility, validating its continued use in modern organic farming.",SoilQA
How does the holistic view of soil as a living entity benefit organic farming?,"The holistic view of soil as a living entity benefits organic farming by emphasizing the interconnectedness of soil components. This approach fosters natural nutrient cycles, enhances biodiversity, and reduces reliance on chemical inputs. Ultimately, it leads to more sustainable and resilient farming systems.",SoilQA
How does the inclusion of diverse ingredients in composting contribute to soil health?,"Including diverse ingredients in composting ensures a broader range of nutrients in the final compost, promoting balanced nutrition and microbial diversity in the soil. This enhances soil health, fertility, and resilience against diseases and environmental stress.",SoilQA
How does the inclusion of herbs in forage leys benefit livestock in organic farming systems?,"Including forage herbs in leys benefits livestock by offering a variety of chemical profiles and thereby a wider range of micronutrients crucial for animal health, nutrition, and productivity, contributing to the overall success of organic farming systems.",SoilQA
"How does the inclusion of ley in crop rotations specifically aid in arable weed control, and what are its long-term benefits?","Inclusion of ley in rotations helps arable weed control by increasing competition against weeds, enhancing soil structure, and improving fertility. Over time, it leads to reduced weed pressure, better crop yields, and sustained soil health without reliance on herbicides.",SoilQA
How does the incorporation of manures and other amendments affect soil cultivation?,"Incorporating manures and other amendments in soil cultivation enhances soil fertility and structure. It also aids in the biological activity of the soil, improving water retention and nutrient availability, which are crucial for healthy crop growth and sustainable farming practices.",SoilQA
How does the initial and subsequent turning frequency of compost affect the decomposition process?,"Initial frequent turning (twice a week) and temperature monitoring kickstart rapid microbial activity and heat production necessary for early decomposition stages. As decomposition stabilizes after initial heating, reduced turning frequency (once a week) maintains microbial activity without disrupting the maturing process, leading to efficient compost maturation.",SoilQA
"How does the interaction of biological, physical, and chemical components affect soil health?","The interaction of biological, physical, and chemical components affects soil health by determining its capacity to support crops and other organisms. Harmonious interaction among these components ensures optimal nutrient availability, soil structure, and biological activity, crucial for sustainable soil health.",SoilQA
How does the maintenance and improvement of soil quality serve future needs?,"The maintenance and improvement of soil quality ensure that future agricultural, social, environmental, and economic needs are met, contributing to sustainable development and resource management.",SoilQA
