question,answer,source
What determines if the compost has finished and is ready?,The length of time needed to mature is debated and standards are under review.,SoilQA
What determines soil structure to a large extent?,Soil structure is largely determined by soil texture and is defined as the arrangement of individual soil particles into clusters known as aggregates.,SoilQA
What determines the balance of fertility in organic farming?,The balance of fertility in organic farming depends on what is removed from the soil and what is returned to it.,SoilQA
What dictates the availability of nutrients from compost?,The amount of material applied influences nutrient availability.,SoilQA
What did Simpson state about soil in 1983?,Simpson described soil as the basis of agriculture and the main raw material for food production. It can be reused year after year with some supplementation.,SoilQA
What did Smith et al (1998) conclude about phosphorus management?,Smith et al (1998) concluded that restricting topsoil extractable P levels to 70 mg/l could minimize unnecessary phosphorus enrichment and subsequent leaching.,SoilQA
What differentiates green manures from other types of cover crops?,"Green manures are specifically grown to be incorporated into the soil, typically at the onset of flowering, to decompose and enrich the soil with organic matter and nutrients. This differentiates them from other cover crops that may primarily aim to cover the soil and prevent erosion.",SoilQA
What disadvantage is associated with rotary cultivators?,Poor burial of residues; very damaging to soil structure; high running cost; can chop and spread rhizome weeds,SoilQA
What disease risks are associated with green manures or cover crops?,Disease risks associated with green manures or cover crops include the potential for plant pathogens to multiply in plant debris.,SoilQA
What distinguishes rye as a cover crop?,"Rye is distinguished as a very popular, winter-hardy cover crop. It should ideally be sown in early October and has a moderate tolerance range within a pH of 5.8 to 8.0.",SoilQA
What do air spaces in fine material indicate?,"They should vary in size, with many small and medium-sized ones.",SoilQA
What do fine and deep roots indicate?,High productivity of the root system and plant.,SoilQA
What do green manures and cover crops provide for soil microorganisms?,They provide a valuable source of food for soil microbial life.,SoilQA
What do nutrient budgets use for input calculations?,Inputs versus outputs.,SoilQA
What do organic farming practices emulate to achieve soil health?,Organic farming practices emulate biological cycles of growth and regeneration to achieve soil health.,SoilQA
What do organic farming systems aim to achieve?,"Organic farming systems aim to achieve sustainability by mimicking natural biological cycles. This involves creating a balanced ecosystem where the processes of death and decay contribute to soil fertility, similar to a natural forest ecosystem.",SoilQA
What do regular branching of roots indicate?,It indicates healthy and normal root development.,SoilQA
What do retainers include?,"Retainers include covers like forage rye, volunteers, and even weeds.",SoilQA
What do soil microorganisms release apart from humus?,"Soil microorganisms release minerals and nutrients, in addition to humus, which are made available to plants through natural processes of regeneration.",SoilQA
What do soils have a tendency for after subsoiling?,Soils have a tendency to form natural pans after subsoiling.,SoilQA
What do the Soil Association Technical Guides typically illustrate?,"The Soil Association Technical Guides typically illustrate various elements of soil health, including nutrient cycles and management practices.",SoilQA
What do the phrases 'soil sickness' and 'feeding the soil' signify in organic farming?,"In organic farming, phrases like 'soil sickness' and 'feeding the soil' signify the importance of treating soil as a vital living system. These terms highlight the need for proper soil management to maintain its health and productivity.",SoilQA
What do waterlogged layers create?,They create anaerobic conditions.,SoilQA
What do waterlogged layers in soil indicate?,"Waterlogged layers in soil indicate anaerobic conditions, meaning there is a lack of oxygen.",SoilQA
What do white roots indicate about soil conditions?,White roots in soil indicate good aerobic activity.,SoilQA
What do white roots indicate?,Good aerobic activity.,SoilQA
What do ‘+’ and ‘-‘ index values in the DEFRA system signify?,"In the DEFRA system, ‘+’ index values indicate values at the higher end of the range, while ‘-‘ index values indicate values at the lower end.",SoilQA
What does Chapter 7 discuss regarding farming methods?,Farming systems,SoilQA
What does Chapter 9 offer to readers?,Further information,SoilQA
What does Simpson's definition imply about the long-term usability of soil in agriculture?,"Simpson's definition implies that soil, unlike most industrial raw materials, can be reused indefinitely in agriculture with minimal supplementation, highlighting its long-term usability for food production.",SoilQA
What does Table 12 summarize?,Table 12 summarizes the main cultivation options along with some of their advantages and disadvantages.,SoilQA
What does Year three recommend planting after winter wheat?,Spring sown root crop.,SoilQA
What does a DEFRA index 1 indicate about soil nutrient levels?,A DEFRA index 1 indicates 'Low' soil nutrient levels.,SoilQA
What does a DEFRA index of 2 indicate in SAC terms?,A DEFRA index of 2 indicates 'Moderate' in SAC terms.,SoilQA
What does a contingency plan for wet weather prevent?,A contingency plan for wet weather prevents the risk of poaching by addressing the challenges posed by unanticipated or prolonged wet periods.,SoilQA
What does a drainage system require to remain effective?,A drainage system requires constant maintenance to remain effective.,SoilQA
What does a fertility management program based on organic matter provide?,"A fertility management program based on organic matter provides a broad range of essential nutrients for plant growth, rather than focusing on a few selected nutrients.",SoilQA
What does a nutrient budget take into account?,Inputs versus outputs.,SoilQA
What does a typical organic rotation consist of?,'Fertility building phase' and 'fertility depleting phase'.,SoilQA
What does a well-balanced nutrient source mean in organic compost?,It contains all nutrients needed by plants and improves soil structure.,SoilQA
What does an ideal time of soil sampling help to avoid?,Conducting sampling when the soil is moist helps avoid compaction problems.,SoilQA
What does an unpleasant odor in compost indicate?,An unpleasant odor in compost indicates that the composting process may not be complete or has not been properly managed.,SoilQA
"What does black, hard straw indicate in soil assessment?",Lack of oxygen or waterlogging.,SoilQA
"What does black, hard straw indicate?",It indicates lack of oxygen or waterlogging.,SoilQA
What does clay content within the layer of coarse material indicate?,The presence and proportion of clay in the soil type.,SoilQA
What does friable mean in the context of finished compost?,"In the context of finished compost, friable means that the compost is easily crumbled.",SoilQA
What does good compost production require in terms of ingredients?,Selection of ingredients for a balanced carbon-to-nitrogen ratio.,SoilQA
What does grass/clover ley primarily involve?,The principal fertility building crops in temperate organic systems.,SoilQA
What does improved soil management aim to achieve in terms of human health?,Improvement in human health through reduced pesticide residues.,SoilQA
What does inversion of the top 30cm of soil affect?,"Soil microorganisms, fungi, and soil animals, especially earthworms.",SoilQA
"What does it mean for soil analysis to indicate high, medium, or low nutrient availability?","This classification helps farmers understand the nutrient status of their soil, guiding decisions on whether additional fertilization or soil management practices are needed.",SoilQA
What does managing diversity of soils aim to support?,"Ecosystems, landscapes, agriculture, and cultural functions.",SoilQA
What does moling require in terms of soil conditions for effectiveness?,Wet enough soil for a clean channel without collapsing.,SoilQA
"What does mouldboard ploughing involve, and what are its immediate benefits?","Mouldboard ploughing inverts soils, covering crop residues and weeds, exposing fresh soil at the surface. This efficiently produces a fine, clean seedbed, often requiring just one or more secondary cultivations to ensure its quality and readiness for planting.",SoilQA
What does nitrogen fixation by legumes contribute to?,Nitrogen fixation by legumes contributes to the nutrients considered in a simple nutrient budget.,SoilQA
What does organic farming guide focus on?,Practical measures for organic farming.,SoilQA
What does organic matter provide for the soil?,Vital food source and balanced nutrients.,SoilQA
What does prolonged bare ground lead to?,"Vulnerability to erosion by wind and rain, and nitrate leaching.",SoilQA
What does reduced tillage mean in terms of soil disturbance?,Reduced tillage involves the use of tines or disks to a depth of 10cm or less.,SoilQA
What does regular turning of windrows involve?,Regular turning of windrows in aerobic windrow composting involves maintaining oxygen in the pile.,SoilQA
What does section 3 of the guide focus on?,"Section 3 focuses on various aspects of soil including its health, biology, fertility, types, structure, nitrogen cycle, phosphorus cycle, and potassium cycle.",SoilQA
What does section 3.1 cover?,Soil health,SoilQA
What does section 3.3 discuss?,Soil fertility,SoilQA
"What does soil health give us an understanding of, according to the guide?",Good soil management,SoilQA
What does soil organic matter (SOM) analysis involve?,Soil organic matter (SOM) content is determined by analyzing the total carbon content and applying a conversion factor. Arable soils usually contain between 1 and 5 percent SOM.,SoilQA
What does spading machine cultivation not damage?,Soil structure,SoilQA
What does spading machine's primary cultivation prevent in the soil?,Does not damage soil structure.,SoilQA
What does stabilised nutrient mean in relation to compost?,"Stabilised nutrients in compost mean that the nutrients have been fully decomposed and integrated into the organic matter, making them available for plant use and resistant to further microbial degradation. This stability also helps prevent pathogen colonization.",SoilQA
What does stable compost mean in terms of nutrient loss?,Lower nutrient loss through runoff or leaching.,SoilQA
What does successive soil sampling help to determine?,Successive soil sampling helps to determine the long-term effects of different management practices on soil fertility by providing data points over extended periods.,SoilQA
What does the DEFRA system index range indicate?,"The DEFRA system index ranges from 0 to 9, where 0 indicates a deficient nutrient level and 9 indicates an excessive nutrient level.",SoilQA
What does the ORGAPLAN program assist with?,Calculating farmgate nutrient budgets.,SoilQA
What does the SAC categorization 'Very low' correspond to in the DEFRA index?,The SAC categorization 'Very low' corresponds to 0 in the DEFRA index.,SoilQA
What does the SAC system in Scotland usually describe?,The SAC system in Scotland usually describes nutrient indices in a descriptive manner.,SoilQA
What does the Soil Association Certification Ltd provide?,"Professional, practical, respected certification for organic products",SoilQA
What does the Soil Association focus on?,"Organic production, inspection, certification, and promotion",SoilQA
What does the Soil Association organic marketing development support?,Initiatives helping UK producers to succeed,SoilQA
What does the Soil Association producer services department represent?,The interests of organic producers,SoilQA
"What does the chemical balance in soil refer to, according to the given text?","The chemical balance in soil refers to the proper ratios of various elements, not just their available quantities. This ensures the soil is correctly proportioned in terms of its nutritional content.",SoilQA
What does the document intend to highlight regarding soil management?,Importance and methods of soil management,SoilQA
What does the fertility building phase typically contain and not include?,"The fertility building phase typically contains a high proportion of legumes. While it is called the fertility building phase, it mainly builds nitrogen and does not add phosphorus (P) or potassium (K) to the system.",SoilQA
What does the final product of compost visually indicate when it is finished?,"It is dark-brown, friable, and not malodorous.",SoilQA
What does the inorganic N pool consist of?,The inorganic N pool consists of plant-available nitrate and ammonium.,SoilQA
What does the journey of crop residues or compost deposited on soil surface involve?,"Crop residues or compost deposited on the soil surface undergo a complex journey, ultimately becoming an essential link between plant and soil by providing vital nutrients.",SoilQA
What does the phrase 'soil sickness' imply in the context of soil health?,"The phrase 'soil sickness' implies a condition where soil is not functioning healthily. It highlights the necessity to manage and treat soil as a living system, much like addressing health issues in humans.",SoilQA
What does the presence of rhizobia on legume roots signify?,The presence of rhizobia on legume roots is significant for assessing root health.,SoilQA
What does the programme OrganicPLAN calculate?,Farmgate nutrient budgets.,SoilQA
What does the repeated representation of soil solution and exchangeable K signify about their relationship in K availability?,"The repeated representation emphasizes the interdependence of soil solution and exchangeable potassium in ensuring readily available potassium for plant uptake, highlighting their critical roles in maintaining immediate potassium availability in the soil.",SoilQA
What does the size of clumps in the coarse material layer denote?,The structure and condition of the soil when analyzed.,SoilQA
What does the soil above the moles need to be dry enough for?,"Dry enough to fracture, ensuring moles are effective.",SoilQA
What does the soil fertility in a forest system derive from?,Conversion of decaying organic matter into humus by soil organisms,SoilQA
What does the soil management plan need to demonstrate?,Adequate consideration for soil fertility and structure.,SoilQA
What does the soil provide for air and water drainage?,Air and drainage channels,SoilQA
What does the stability of compost imply for nutrient retention?,"The stability of compost implies that nutrient losses through runoff or leaching are much lower, ensuring more nutrients remain in the soil for crops.",SoilQA
What does the technical guide advise on?,Soil management,SoilQA
What does the term 'in-situ' refer to in the context of green manures?,"In the context of green manures, 'in-situ' refers to incorporating the green manures directly into the soil where they grow.",SoilQA
What does the text mention as the downside of the summer forage crop?,Grass can be less plentiful and of lower quality.,SoilQA
What does the text say about the duration to establish a suitable crop break?,Approximately one year.,SoilQA
What does the text suggest about using a mixture of rye and vetches?,Sowing mixtures delivers balanced nitrogen supply.,SoilQA
What does the time gap before sowing maize help in managing?,The time gap before sowing maize helps in managing the exhaustion of rootstocks of perennial weeds.,SoilQA
What does this guide provide for users?,Understanding of soil and practical information to maintain soil health.,SoilQA
What does using nutrient budgets in livestock and upland systems provide?,Insight into pollution prevention.,SoilQA
What does weed control by ‘cut competing’ involve?,It involves either cutting or avoiding the conditions that allow weed seeds to germinate in the first place.,SoilQA
What does yellow hard straw in soil indicate about biological activity?,Yellow hard straw in soil indicates low biological activity.,SoilQA
What does yellow hard straw indicate?,It is an indication of low biological activity.,SoilQA
What drawbacks do rotary cultivators present despite their fair mixing capabilities?,"Despite fair mixing capabilities, rotary cultivators present several drawbacks, including poor burial of residues, significant damage to soil structure, high running costs, and the potential to spread rhizome weeds. These factors can reduce soil health and increase operational expenses.",SoilQA
What duration allows for sainfoin and lucerne to be used for cutting or grazing?,Sainfoin and lucerne can be used for cutting or grazing for up to four years.,SoilQA
What ecological disasters have resulted from soil mismanagement?,"Due to soil mismanagement, ecological disasters such as soil degradation, salinisation, acidification, and declining soil structure, fertility, and carbon bank have occurred, negatively affecting agricultural production.",SoilQA
What ecological problems arise from past soil mismanagement?,"Soil erosion, salinization, acidification, and declining structure and fertility.",SoilQA
What effect does high autumn drainage have on nitrate leaching and why is it problematic?,"High autumn drainage results in excess nitrate leaching because drainage carries the nitrates away from the soil, making them unavailable for the following crops and causing potential environmental damage, particularly near watercourses.",SoilQA
What effect does improving the organic matter content in sandy soils have on crop yield?,Improving organic matter content in sandy soils results in a significant enhancement of crop yield.,SoilQA
What effect does removing stones before soil analysis have?,"Removing stones can mislead soil analysis results because if 50% of the soil is stones, the actual nutrient availability is only half of the reported value.",SoilQA
What effect does the timing and method of incorporation have on green manures?,It synchronizes nutrient mineralization with crop demand periods.,SoilQA
What efforts should be made to prevent soil from laying bare?,"Efforts should be made to prevent the soil from laying bare for any prolonged period, especially over winter, by using cover crops where necessary.",SoilQA
What element in the soil does shelter belts affect and how should they be managed?,Shelter belts have an effect over a distance up to 20 times their height and should be carefully sited in relation to the prevailing wind direction.,SoilQA
What element's cycle is highlighted predominantly in the provided text?,The provided text predominantly highlights the nitrogen cycle.,SoilQA
What elements are specifically mentioned in the text as part of the soil's chemical balance?,"The elements specifically mentioned are phosphorus (P), potassium (K), and magnesium (Mg).",SoilQA
What elements will be considered in the soil management plan?,"Rotation design, fertilisation strategy, composting, cultivations, and livestock management.",SoilQA
What ensures that samples are accurate and traceable when sent for analysis?,"Sending samples in clean, well-labelled plastic bags ensures that they are accurate and traceable when sent for analysis.",SoilQA
What ensures that soil samples will be representative of the field?,Sampling,SoilQA
What environment is required for the microbial decomposition of compost?,The microbial decomposition of compost requires an aerobic environment to effectively produce humus and stabilise nutrients.,SoilQA
What environmental benefit do cover crops offer during their growth?,"Cover crops offer the environmental benefit of preventing nitrate leaching into the groundwater, thus protecting water quality while also conserving soil health by covering and protecting it.",SoilQA
"What environmental damage can result from nitrate leaching, particularly near watercourses?","Nitrate leaching near watercourses can cause eutrophication, leading to algae blooms that deplete oxygen levels, harming aquatic life. It also results in water pollution, making it unsafe for drinking and harming broader ecosystems. Proper management of nitrate levels is essential to prevent such damage.",SoilQA
What environmental factors can exacerbate magnesium (Mg) deficiency in soil?,Poor soil structure and drought conditions can exacerbate magnesium deficiencies in soil.,SoilQA
What environmental risks are associated with the inorganic N pool?,The environmental risks associated with the inorganic N pool include potential contamination from nitrate and ammonium.,SoilQA
What enzyme do Rhizobia produce and what does it do?,"Rhizobia produce an enzyme called nitrogenase, which converts atmospheric nitrogen gas into ammonia, making nitrogen available for plant use.",SoilQA
What equipment can be initially used to construct the compost heap?,A front-end loader and FYM spreader,SoilQA
What equipment can be used initially to construct the compost heap?,A front-end loader and an FYM spreader fitted with rear doors can be used initially to construct the compost heap.,SoilQA
What equipment might be considered worthwhile for a regular turning schedule of compost?,Specialist turning equipment.,SoilQA
What essential functions are performed by soil biology in ecosystems?,"Soil biology is responsible for several essential functions in ecosystems, including nutrient cycling, disease suppression, and pollutant degradation. These functions are key for maintaining the health and sustainability of ecosystems.",SoilQA
What essential functions does soil biology perform aside from nutrient cycling?,"Besides nutrient cycling, soil biology is crucial for disease suppression and the degradation of pollutants, contributing significantly to the overall health and sustainability of ecosystems.",SoilQA
What essential functions of soil should a global soil policy consider?,"A global soil policy should consider essential soil functions like nutrient cycling, water filtration, carbon storage, and supporting biodiversity. Such policy must also promote practices that maintain these functions to foster environmental sustainability and agricultural productivity.",SoilQA
What essential management practices are recommended to prevent nutrient loss in organic farming?,"To prevent nutrient loss in organic farming, it's crucial to adopt robust management practices such as appropriate manure application, cover cropping, and monitoring nutrient gains and losses. These practices help maintain soil fertility and enhance crop productivity.",SoilQA
What essential roles does soil biology perform?,"Soil biology plays crucial roles, including nutrient cycling, disease suppression, and the degradation of pollutants. These functions are essential for maintaining healthy ecosystems.",SoilQA
What evidence suggests that AM fungi protect plants from harmful infections?,"Evidence suggests that AM fungi help protect plants from harmful fungal infections, adding a protective benefit to their symbiotic relationship.",SoilQA
What exceptions exist for investment returns in drainage?,"Investment in drainage generally yields good returns, except in pastural areas experiencing high rainfall.",SoilQA
What factor can influence the timing and frequency of soil cultivation?,Soil type.,SoilQA
What factor can reduce the effective period of mole drains?,The presence of sand pockets in the subsoil can reduce the effective period of mole drains.,SoilQA
What factor makes rock forms of potassium less efficient for plants?,Rock forms of potassium are less efficient for plants because they release potassium much slower compared to the by-products of crop processing like Kali Vanesse and Raphinate.,SoilQA
What factors are examined in soil life assessment?,Number of earthworm burrows and extent of visible soil-life activity are key factors in assessing soil life.,SoilQA
What factors are important in determining erosion risk?,"Soil texture, soil structure, and slope are key factors in determining the risk of soil erosion.",SoilQA
What factors can influence the nutrient release from compost?,Microbial status of the soil and soil temperature,SoilQA
What factors contribute to increasing soil organic matter over time?,"Soil organic matter increases over time with regular additions of farmyard manure (FYM), composts, and crop residues like green manures, cover crops, and grass/clover leys. These organic inputs enhance soil structure, fertility, and microbial activity, contributing to sustainable soil management.",SoilQA
What factors contribute to the high calcium content and pH range of calcareous soils?,"Calcareous soils contain high amounts of calcium carbonate from geological parent materials, resulting in a neutral to slightly alkaline pH of 6.5–8.0.",SoilQA
What factors contribute to the toxicity of chemicals in the soil despite microbial activity?,"Factors contributing to the toxicity of chemicals in soil include high concentrations of pollutants and their repeated application. These scenarios overwhelm the natural decomposition capacity of soil organisms, leading to an accumulation of toxic substances that can adversely affect soil health and ecosystem balance.",SoilQA
What factors determine soil health?,"Soil health is determined by the biological, physical, and chemical components of the soil and the interactions between these elements.",SoilQA
